{"event_id":"EQA-EVT-EXAMPLE-001","event_type":"output_derived","entity_id":"OUT-EXAMPLE","activity_id":"EQA-ACT-EXAMPLE-001","agent_ids":["EQA"],"input_ids":["ART-CH"],"output_ids":["OUT-EXAMPLE"],"authority_ids":["MWM-EQA-RULES"],"evidence_ids":["TE-E1"],"status_before":null,"status_after":"ready_with_tracked_items","fixity":"sha256:out","event_time":"2026-08-14T00:00:00Z","append_only":true,"supersedes":null}
